{
  "id": "transformer",
  "name": "Transformer block",
  "type": "icon",
  "domain": ["ml"],
  "tags": ["transformer", "attention", "multi-head", "feed-forward", "encoder", "decoder", "block", "nlp"],
  "author": "OpenTikZ contributors",
  "license": "CC0-1.0",
  "requires": ["tikz"],
  "preview": "transformer.svg",
  "description": "A transformer block: stacked multi-head-attention and feed-forward sub-layers with an x N repeat indicator."
}
