{
  "id": "distributed-training",
  "name": "Distributed data-parallel training",
  "type": "example",
  "domain": ["ml", "systems"],
  "tags": ["distributed training", "data parallel", "parameter server", "gpu", "gradients", "synchronization", "system diagram"],
  "venue": ["NeurIPS", "MLSys", "OSDI"],
  "author": "OpenTikZ contributors",
  "license": "CC0-1.0",
  "requires": ["tikz", "arrows.meta", "positioning"],
  "preview": "preview.svg",
  "featured": true,
  "composed_of": ["dataset", "gpu", "server"],
  "description": "Paper-grade figure composing the dataset, gpu, and server icons: a training-data source shards batches to GPU workers that exchange gradients and weights with a parameter server."
}
