{
  "id": "system-block-diagram",
  "name": "System block diagram",
  "type": "template",
  "domain": ["systems"],
  "tags": ["system", "architecture", "block diagram", "microservices", "components", "database", "cache", "data flow"],
  "venue": ["NSDI", "OSDI", "SOSP", "SIGCOMM"],
  "author": "OpenTikZ contributors",
  "license": "CC0-1.0",
  "requires": ["tikz"],
  "preview": "preview.svg",
  "description": "General system architecture diagram: external client, process boxes (gateway/services), datastore cylinders (database/cache), branching connections, and a dashed subsystem group box. Multiple component types, parametric spacing."
}
