{
  "id": "lora",
  "name": "LoRA (low-rank adaptation)",
  "type": "example",
  "domain": ["ml"],
  "tags": ["lora", "low-rank adaptation", "fine-tuning", "peft", "frozen weights", "adapter", "transformer", "merged weights"],
  "venue": ["NeurIPS", "ICLR", "ICML"],
  "author": "OpenTikZ contributors",
  "license": "CC0-1.0",
  "requires": ["tikz", "amsmath", "amssymb"],
  "preview": "preview.svg",
  "featured": true,
  "composed_of": ["layer", "encoder-decoder"],
  "description": "Low-rank adaptation (LoRA), two-panel homage after Hu et al., 2021. During training: a frozen pretrained weight W feeds Wx in parallel with a trainable low-rank update B·A (rank-r bottleneck, A=N(0,sigma^2), B=0) feeding BAx, summed to h. After training: the adapter is folded into a single merged weight matrix W_merged, shown as a bar–square–bar stack. Center column gives h = Wx + BAx = (W + BA)x."
}
